{
  "$schema": "http://json-schema.org/draft-07/schema#",
  "title": "QWeld Question",
  "type": "object",
  "additionalProperties": false,
  "required": [
    "id",
    "taskId",
    "stem",
    "choices",
    "correctId"
  ],
  "properties": {
    "id": {
      "type": "string",
      "pattern": "^Q-[0-9A-Za-z_-]+$"
    },
    "taskId": {
      "type": "string",
      "pattern": "^[A-D]-\\d+$"
    },
    "stem": {
      "type": "string",
      "minLength": 1
    },
    "choices": {
      "type": "array",
      "minItems": 4,
      "maxItems": 4,
      "uniqueItems": true,
      "items": {
        "type": "object",
        "additionalProperties": false,
        "required": ["id", "text"],
        "properties": {
          "id": {
            "type": "string",
            "pattern": "^CHOICE-[0-9A-Za-z_-]+$"
          },
          "text": {
            "type": "string",
            "minLength": 1
          }
        }
      }
    },
    "correctId": {
      "type": "string",
      "pattern": "^CHOICE-[0-9A-Za-z_-]+$"
    },
    "difficulty": {
      "type": "string",
      "enum": ["easy", "medium", "hard"]
    },
    "rationales": {
      "type": "object",
      "minProperties": 1,
      "additionalProperties": {
        "type": "string",
        "minLength": 1
      }
    },
    "tags": {
      "type": "array",
      "items": {
        "type": "string",
        "minLength": 1
      }
    },
    "source": {
      "type": "string",
      "minLength": 1
    }
  },
  "allOf": [
    {
      "properties": {
        "choices": {
          "contains": {
            "type": "object",
            "properties": {
              "id": {
                "const": { "$data": "1/correctId" }
              }
            },
            "required": ["id"]
          }
        }
      }
    }
  ]
}
