{
  "id": "Q-D-12_e7018_70ksi_10000047",
  "taskId": "D-12",
  "difficulty": "easy",
  "stem": "In the designation E7018, what does the '70' indicate?",
  "choices": [
    {
      "id": "CHOICE-1",
      "text": "70% joint efficiency"
    },
    {
      "id": "CHOICE-2",
      "text": "70 A recommended current"
    },
    {
      "id": "CHOICE-3",
      "text": "70,000 psi minimum tensile strength"
    },
    {
      "id": "CHOICE-4",
      "text": "70Â° included bevel angle"
    }
  ],
  "correctId": "CHOICE-3",
  "rationales": {
    "CHOICE-3": "The first two digits give the minimum tensile strength in ksi."
  }
}
