{
  "id": "Q-B-7_shim_uniform_gap_v4_04_30000057",
  "taskId": "B-7",
  "difficulty": "easy",
  "stem": "Why use shims during fit-up?",
  "choices": [
    {
      "id": "CHOICE-1",
      "text": "To hide defects"
    },
    {
      "id": "CHOICE-2",
      "text": "To ensure a consistent root gap when parts vary"
    },
    {
      "id": "CHOICE-3",
      "text": "To replace beveling"
    },
    {
      "id": "CHOICE-4",
      "text": "Only for painting"
    }
  ],
  "correctId": "CHOICE-2",
  "rationales": {
    "CHOICE-2": "Shims help set uniform gaps before welding."
  }
}
