{
  "id": "Q-C-11_angle_caca_10000044",
  "taskId": "C-11",
  "difficulty": "medium",
  "stem": "What is a typical electrode angle for CAC‑A?",
  "choices": [
    {
      "id": "CHOICE-1",
      "text": "Push 90° straight into the work"
    },
    {
      "id": "CHOICE-2",
      "text": "Lead the electrode 15–20° in the travel direction"
    },
    {
      "id": "CHOICE-3",
      "text": "Drag opposite the travel 45°"
    },
    {
      "id": "CHOICE-4",
      "text": "Point straight down"
    }
  ],
  "correctId": "CHOICE-2",
  "rationales": {
    "CHOICE-2": "A small lead angle directs the molten metal out of the gouge."
  }
}
