{
  "id": "Q-B-7_edge_prep_1000002e",
  "taskId": "B-7",
  "difficulty": "easy",
  "stem": "Зачем удалять burrs and oxides from prepared edges?",
  "choices": [
    {
      "id": "CHOICE-1",
      "text": "It saves time but уменьшает strength"
    },
    {
      "id": "CHOICE-2",
      "text": "It — unnecessary on any material"
    },
    {
      "id": "CHOICE-3",
      "text": "It улучшает сплавление and уменьшает inclusions"
    },
    {
      "id": "CHOICE-4",
      "text": "It — только for aluminum"
    }
  ],
  "correctId": "CHOICE-3",
  "rationales": {
    "CHOICE-3": "Clean, smooth edges promote full сплавление and fewer inclusions."
  }
}
