{
  "id": "Q-B-7_interpass_cleaning_v2_06_30000043",
  "taskId": "B-7",
  "difficulty": "easy",
  "stem": "Between passes with flux-shielded processes you should:",
  "choices": [
    {
      "id": "CHOICE-1",
      "text": "Leave slag; it burns out"
    },
    {
      "id": "CHOICE-2",
      "text": "Remove slag and heavy spatter"
    },
    {
      "id": "CHOICE-3",
      "text": "Only chip the cap"
    },
    {
      "id": "CHOICE-4",
      "text": "Water quench the bead"
    }
  ],
  "correctId": "CHOICE-2",
  "rationales": {
    "CHOICE-2": "Cleaning prevents slag inclusions and lack of fusion."
  }
}
