{
  "id": "Q-D-12_e7018_70ksi_10000047",
  "taskId": "D-12",
  "difficulty": "easy",
  "stem": "В обозначении E7018 что означает «70»?",
  "choices": [
    {
      "id": "CHOICE-1",
      "text": "Эффективность соединения 70%"
    },
    {
      "id": "CHOICE-2",
      "text": "Рекомендуемый ток 70 А"
    },
    {
      "id": "CHOICE-3",
      "text": "Минимальная прочность на растяжение 70 000 psi"
    },
    {
      "id": "CHOICE-4",
      "text": "70° included угла скоса кромок"
    }
  ],
  "correctId": "CHOICE-3",
  "rationales": {
    "CHOICE-3": "The first two digits give the minimum tensile strength in ksi."
  }
}
