{
  "id": "Q-D-15_multi_wire_saw_v1_05_40000104",
  "taskId": "D-15",
  "difficulty": "medium",
  "stem": "A benefit of multi‑wire SAW systems is:",
  "choices": [
    {
      "id": "CHOICE-1",
      "text": "Lower deposition rate"
    },
    {
      "id": "CHOICE-2",
      "text": "Higher deposition rate and productivity"
    },
    {
      "id": "CHOICE-3",
      "text": "Elimination of flux"
    },
    {
      "id": "CHOICE-4",
      "text": "All‑position capability"
    }
  ],
  "correctId": "CHOICE-2",
  "rationales": {
    "CHOICE-2": "Multiple wires increase deposition/productivity."
  }
}
