{
  "id": "Q-C-8_blotters_10000032",
  "taskId": "C-8",
  "difficulty": "medium",
  "stem": "Why are paper blotters used between grinding wheel flanges and the wheel?",
  "choices": [
    {
      "id": "CHOICE-1",
      "text": "Decoration only"
    },
    {
      "id": "CHOICE-2",
      "text": "They distribute clamping force and protect the wheel"
    },
    {
      "id": "CHOICE-3",
      "text": "They increase vibration"
    },
    {
      "id": "CHOICE-4",
      "text": "They trap oil for lubrication"
    }
  ],
  "correctId": "CHOICE-2",
  "rationales": {
    "CHOICE-2": "Blotters cushion and spread load to reduce stress concentrations."
  }
}
