{
  "id": "Q-A-2_scaffold_inspect_tag_20000018",
  "taskId": "A-2",
  "difficulty": "medium",
  "stem": "Before using a scaffold, a best practice is to:",
  "choices": [
    {
      "id": "CHOICE-1",
      "text": "Assume it’s safe if present"
    },
    {
      "id": "CHOICE-2",
      "text": "Check that it’s tagged/inspected by a competent person"
    },
    {
      "id": "CHOICE-3",
      "text": "Jump to test deflection"
    },
    {
      "id": "CHOICE-4",
      "text": "Remove guardrails to work faster"
    }
  ],
  "correctId": "CHOICE-2",
  "rationales": {
    "CHOICE-2": "Use only inspected scaffolds with proper tags and guardrails in place."
  }
}
