{
  "id": "Q-D-14_oxide_cleaning_al_v6_05_400000fa",
  "taskId": "D-14",
  "difficulty": "medium",
  "stem": "On aluminum GTAW, oxide cleaning action is provided by:",
  "choices": [
    {
      "id": "CHOICE-1",
      "text": "Electrode‑negative (EN) portion"
    },
    {
      "id": "CHOICE-2",
      "text": "Electrode‑positive (EP) portion of AC"
    },
    {
      "id": "CHOICE-3",
      "text": "Back purging"
    },
    {
      "id": "CHOICE-4",
      "text": "Helium only"
    }
  ],
  "correctId": "CHOICE-2",
  "rationales": {
    "CHOICE-2": "The EP half‑cycle breaks the oxide film."
  }
}
