{
  "id": "Q-D-13_inductance_effect_v6_07_40000093",
  "taskId": "D-13",
  "difficulty": "hard",
  "stem": "In shortâ€‘circuit GMAW, increasing inductance generally:",
  "choices": [
    {
      "id": "CHOICE-1",
      "text": "Makes arc harsher with more spatter"
    },
    {
      "id": "CHOICE-2",
      "text": "Softens arc and reduces spatter"
    },
    {
      "id": "CHOICE-3",
      "text": "Has no effect"
    },
    {
      "id": "CHOICE-4",
      "text": "Prevents fusion"
    }
  ],
  "correctId": "CHOICE-2",
  "rationales": {
    "CHOICE-2": "Greater inductance slows current rise and reduces spatter."
  }
}
