{
  "id": "Q-D-13_worm_tracks_10000060",
  "taskId": "D-13",
  "difficulty": "hard",
  "stem": "Что often causes 'червоточин (worm tracks)' in FCAW (порошковая)-G deposits?",
  "choices": [
    {
      "id": "CHOICE-1",
      "text": "Perfect shielding and low напряжение"
    },
    {
      "id": "CHOICE-2",
      "text": "Excessive напряжение/heat or surface contamination causing gas channels"
    },
    {
      "id": "CHOICE-3",
      "text": "Too short вылет только"
    },
    {
      "id": "CHOICE-4",
      "text": "Using solid wire"
    }
  ],
  "correctId": "CHOICE-2",
  "rationales": {
    "CHOICE-2": "Gas bubbles under the шлак can leave tracks когда напряжение/heat — high or surfaces — dirty."
  }
}
