{
  "id": "Q-C-8_wheel_storage_v2_04_3000008c",
  "taskId": "C-8",
  "difficulty": "easy",
  "stem": "How should bonded abrasive wheels be stored?",
  "choices": [
    {
      "id": "CHOICE-1",
      "text": "In a damp area to keep cool"
    },
    {
      "id": "CHOICE-2",
      "text": "Dry, flat, protected from impact"
    },
    {
      "id": "CHOICE-3",
      "text": "Hanging by the arbor hole"
    },
    {
      "id": "CHOICE-4",
      "text": "Under heavy weights"
    }
  ],
  "correctId": "CHOICE-2",
  "rationales": {
    "CHOICE-2": "Moisture/impacts damage wheels; keep them dry and supported."
  }
}
