{
  "id": "Q-D-13_push_vs_pull_1000005f",
  "taskId": "D-13",
  "difficulty": "medium",
  "stem": "Compared with pulling, pushing the GMAW (MIG/MAG) gun typically:",
  "choices": [
    {
      "id": "CHOICE-1",
      "text": "Produces deeper проплавление and narrow bead"
    },
    {
      "id": "CHOICE-2",
      "text": "Produces a wider, flatter bead with slightly less проплавление"
    },
    {
      "id": "CHOICE-3",
      "text": "Has identical results"
    },
    {
      "id": "CHOICE-4",
      "text": "Always causes lack of сплавление"
    }
  ],
  "correctId": "CHOICE-2",
  "rationales": {
    "CHOICE-2": "Push angles broaden the bead and slightly уменьшить проплавление."
  }
}
