{
  "id": "Q-A-3_ppe_face_shield_grind_20000040",
  "taskId": "A-3",
  "difficulty": "easy",
  "stem": "For bench шлифования operations, appropriate eye/face protection is:",
  "choices": [
    {
      "id": "CHOICE-1",
      "text": "No eye protection for quick jobs"
    },
    {
      "id": "CHOICE-2",
      "text": "Safety glasses only"
    },
    {
      "id": "CHOICE-3",
      "text": "Safety glasses plus a face shield"
    },
    {
      "id": "CHOICE-4",
      "text": "Sunglasses"
    }
  ],
  "correctId": "CHOICE-3",
  "rationales": {
    "CHOICE-3": "Use both safety glasses and a face shield for шлифования tasks."
  }
}
