{
  "id": "Q-D-14_helium_mixture_v6_08_400000fd",
  "taskId": "D-14",
  "difficulty": "medium",
  "stem": "Adding helium to argon защитного газа generally:",
  "choices": [
    {
      "id": "CHOICE-1",
      "text": "Reduces тепловложение"
    },
    {
      "id": "CHOICE-2",
      "text": "Increases heat/проплавление and скорость перемещения"
    },
    {
      "id": "CHOICE-3",
      "text": "Eliminates need for AC (переменный ток)"
    },
    {
      "id": "CHOICE-4",
      "text": "Always causes пористости"
    }
  ],
  "correctId": "CHOICE-2",
  "rationales": {
    "CHOICE-2": "He-Ar mixes raise arc напряжение and тепловложение."
  }
}
