{
  "id": "Q-C-8_rpm_rating_match_v1_01_3000007e",
  "taskId": "C-8",
  "difficulty": "easy",
  "stem": "How should an abrasive wheel’s RPM rating relate to the tool?",
  "choices": [
    {
      "id": "CHOICE-1",
      "text": "Wheel rating may be below tool speed"
    },
    {
      "id": "CHOICE-2",
      "text": "Wheel rating must meet or exceed the tool’s maximum RPM"
    },
    {
      "id": "CHOICE-3",
      "text": "RPMs do not matter"
    },
    {
      "id": "CHOICE-4",
      "text": "Any mismatch is fine briefly"
    }
  ],
  "correctId": "CHOICE-2",
  "rationales": {
    "CHOICE-2": "The wheel must be rated for at least the tool’s speed."
  }
}
