{
  "id": "Q-A-3_wet_conditions_20000039",
  "taskId": "A-3",
  "difficulty": "medium",
  "stem": "If сварки must be performed in damp conditions, you should:",
  "choices": [
    {
      "id": "CHOICE-1",
      "text": "Stand in water for stability"
    },
    {
      "id": "CHOICE-2",
      "text": "Use УЗО (GFCI) protection, dry platforms, and extra insulation"
    },
    {
      "id": "CHOICE-3",
      "text": "Удалить gloves to feel the heat"
    },
    {
      "id": "CHOICE-4",
      "text": "Ignore site rules for speed"
    }
  ],
  "correctId": "CHOICE-2",
  "rationales": {
    "CHOICE-2": "Use dry platforms, УЗО (GFCI), and insulation to reduce shock risk."
  }
}
