{
  "id": "Q-C-10_start_methods_10000041",
  "taskId": "C-10",
  "difficulty": "easy",
  "stem": "Что — the advantage of pilot-arc or HF start in PAC?",
  "choices": [
    {
      "id": "CHOICE-1",
      "text": "They require scraping the сопло on the work"
    },
    {
      "id": "CHOICE-2",
      "text": "They initiate the arc without dragging the сопло"
    },
    {
      "id": "CHOICE-3",
      "text": "They уменьшить the need for shielding"
    },
    {
      "id": "CHOICE-4",
      "text": "They увеличивает consumable wear"
    }
  ],
  "correctId": "CHOICE-2",
  "rationales": {
    "CHOICE-2": "Non-контактный starts protect the сопло and улучшить reliability."
  }
}
