{
  "id": "Q-D-15_flux_moisture_care_v2_00_40000109",
  "taskId": "D-15",
  "difficulty": "medium",
  "stem": "Как следует SAW (под флюсом) флюса be handled to avoid пористости?",
  "choices": [
    {
      "id": "CHOICE-1",
      "text": "Store open to shop air"
    },
    {
      "id": "CHOICE-2",
      "text": "Keep dry; bake per manufacturer if wet"
    },
    {
      "id": "CHOICE-3",
      "text": "Mix with oil to bind dust"
    },
    {
      "id": "CHOICE-4",
      "text": "Wash with water"
    }
  ],
  "correctId": "CHOICE-2",
  "rationales": {
    "CHOICE-2": "Moisture introduces hydrogen; keep флюса dry."
  }
}
