{
  "id": "Q-D-13_burnback_cause_v7_04_4000009a",
  "taskId": "D-13",
  "difficulty": "easy",
  "stem": "What typically causes 'burnback' (wire fusing to the contact tip)?",
  "choices": [
    {
      "id": "CHOICE-1",
      "text": "Too long stickout"
    },
    {
      "id": "CHOICE-2",
      "text": "Too short stickout or too slow wire feed relative to voltage"
    },
    {
      "id": "CHOICE-3",
      "text": "High gas flow"
    },
    {
      "id": "CHOICE-4",
      "text": "Correct inductance"
    }
  ],
  "correctId": "CHOICE-2",
  "rationales": {
    "CHOICE-2": "If burnoff exceeds feed, the arc retreats and fuses the tip."
  }
}
