{
  "id": "Q-B-7_backing_bar_purpose_v1_02_30000034",
  "taskId": "B-7",
  "difficulty": "easy",
  "stem": "What is the purpose of a backing bar/strip?",
  "choices": [
    {
      "id": "CHOICE-1",
      "text": "To support the root pass and help prevent burn-through"
    },
    {
      "id": "CHOICE-2",
      "text": "To add no benefit"
    },
    {
      "id": "CHOICE-3",
      "text": "To replace all tacks"
    },
    {
      "id": "CHOICE-4",
      "text": "It is forbidden by all codes"
    }
  ],
  "correctId": "CHOICE-1",
  "rationales": {
    "CHOICE-1": "Backing supports the root and can aid complete penetration."
  }
}
